review_id,business_id,user_id,stars,date,text
TcCcHzc3L6Aboq3DteEfZA,jNL5KUPz2-tHUJM__ysSaw,OuatwND396ZQxm2zK8WlUQ,1.0,2014-08-24 20:14:12,"If you want to pay for everything a la carte this is the place for you.  
Food wasn't terrible not impressive.
They brought a basket of chips and some tomato sauce which I asked politely for something spicier and some pico de gallo.  She brought them happily to me and the salsa was much better.  When asked what we would like to drink I asked for a coke and she brought out a bottle which I stated I wanted the fountain drink.  She said ""oh that's only Pepsi"".  Never mentioned that they only had bottle drinks for coke.  
We ordered our food which was reasonably priced, asked for sour cream and also to put cheese on the taco.  She let us know cheese was extra.  
It was $2.50 extra for another basket of chips.  
When I received the bill we paid more for the condiments then the actual food.  Side of sour cream 2.00, pico de gallo 2.50, salsa 2.00, chips 2.50, cheese 1.00 and the bottled coke that we didn't want 5.00.  
Just a suggestion...when you order anything make sure to ask if there is an extra charge."
A4n4YaE-owOVgTQcrVqHUw,I6L0Zxi5Ww0zEWSAVgngeQ,S7bjj-L07JuRr-tpX1UZLw,4.0,2018-07-07 20:50:12,The cafe was extremely cute. We came at 8am and they even had a jazz band playing at that time. I got the breakfast sandwich and it was delicious. I loved how they rolled the egg and put the bacon pieces inside. Great price for a filling breakfast!
cvQXRFLCyr0S7EgFb4lZqw,EtKSTHV5Qx_Q7Aur9o4kQQ,ZGjgfSvjQK886kiTzLwfLQ,5.0,2009-10-14 01:15:04,"On a scale of one to things that are awesome, this place is the bomb. 

I was drawn in by the promise of the duckfat frenchfries. Took the boy for his birthday and put our name in, had a drink around the corner while we waited and were given seats at the bar after about 45 minutes. 

We were waited on by Keith, the bartender, who was congenial, knowledgeable about his whiskeys and an all-around cool guy. We started with 3 cape may salts (two for me, one for the boy) and tater tots, both of which made me happy.

For dinner, I got Kentucky Fried Quail (stellar, though the succotash was not as exciting as I wanted it to be) and the boy got the 24$ Fois Gras burger, which was incredible. Worth every penny. The duckfat fries were pretty yummy, but not even the best part of the meal. I could've done without the cheese sauce, but as it was on the side I wasn't deterred.

I look forward to coming back here, with everyone I know."
